{"boundedApplicantData":[{"contract":"workflow-canary-application-v1","files":["application.json"],"rootPath":"canary-submissions"},{"contract":"public-pr-application-v2-six-file-v1","files":["PROPOSAL.md","TEST_PLAN.md","THREAT_MODEL.md","application.json","compatibility-report.json","evidence-index.json"],"rootPath":"submissions"},{"contract":"public-pr-application-v3.1-immutable-revision-v1","layout":"application-v3-revision-tree","maximumFileBytes":4194304,"maximumFiles":100,"maximumPackageBytes":12582912,"rootFile":"application.v3.json","rootMaximumBytes":262144,"rootPath":"submissions"}],"canonicalPolicy":{"path":"policy/launch-policy.v1.json","schemaPath":"policy/schemas/launch-policy.v1.schema.json"},"entrypoints":[{"frozenVendorImports":["vendor/programmable-applicant-validator/scripts/public-applicant-validator.mjs","vendor/programmable-v4-hook-builder/scripts/github-public-source-lossless-json.mjs"],"id":"frozen-legacy-review-cli","moduleClosure":["review/cli.mjs","review/launch-policy-review-core.mjs","review/open-review-engine.mjs","scripts/launch-policy-core.mjs","scripts/launch-policy-handlers.mjs"],"path":"review/cli.mjs","role":"frozen-legacy-review"},{"frozenVendorImports":["vendor/programmable-applicant-validator/scripts/public-applicant-validator.mjs"],"id":"current-policy-reviewer","moduleClosure":["review/launch-policy-review-core.mjs","scripts/launch-policy-core.mjs","scripts/launch-policy-handlers.mjs"],"path":"review/launch-policy-review-core.mjs","role":"current-review"},{"frozenVendorImports":["vendor/programmable-applicant-validator/scripts/public-applicant-validator.mjs","vendor/programmable-v4-hook-builder/scripts/github-public-source-lossless-json.mjs"],"id":"website-canary-eligibility-compiler","moduleClosure":["review/launch-policy-review-core.mjs","scripts/canary-eligibility-core.mjs","scripts/compile-canary-eligibility.mjs","scripts/launch-policy-core.mjs","scripts/launch-policy-handlers.mjs","scripts/workflow-canary-core.mjs"],"path":"scripts/compile-canary-eligibility.mjs","role":"website-canary-eligibility"},{"frozenVendorImports":["vendor/programmable-applicant-validator/scripts/public-applicant-validator.mjs","vendor/programmable-v4-hook-builder/scripts/github-public-source-core.mjs"],"id":"disabled-legacy-entitlement-compiler","moduleClosure":["review/launch-policy-review-core.mjs","scripts/acceptance-entitlement-core.mjs","scripts/compile-launch-entitlement.mjs","scripts/launch-policy-core.mjs","scripts/launch-policy-handlers.mjs","scripts/verify-open-world-v2-contracts.mjs","scripts/verify-open-world-v2-package.mjs","scripts/verify-open-world-v2-validation-fee.mjs","scripts/verify-open-world-v2-validation-intake.mjs","scripts/verify-open-world-v2-validation-intent.mjs","scripts/verify-public-application-v3-core.mjs","scripts/verify-public-application-v3-generation.mjs","scripts/verify-public-application-v3-shared.mjs","scripts/verify-public-hook-application-core.mjs","scripts/workflow-canary-core.mjs"],"path":"scripts/compile-launch-entitlement.mjs","role":"disabled-legacy-entitlement"},{"frozenVendorImports":["vendor/programmable-applicant-validator/scripts/public-applicant-validator.mjs","vendor/programmable-v4-hook-builder/scripts/resolve-contract-validation.mjs"],"id":"policy-projection-generator","moduleClosure":["scripts/generate-launch-policy-artifacts.mjs","scripts/launch-policy-core.mjs","scripts/launch-policy-handlers.mjs"],"path":"scripts/generate-launch-policy-artifacts.mjs","role":"policy-projection"},{"frozenVendorImports":["vendor/programmable-applicant-validator/scripts/public-applicant-validator.mjs"],"id":"current-policy-cli","moduleClosure":["scripts/launch-policy-core.mjs","scripts/launch-policy-handlers.mjs","scripts/launch-policy.mjs"],"path":"scripts/launch-policy.mjs","role":"current-policy-read"},{"frozenVendorImports":["vendor/programmable-applicant-validator/scripts/public-applicant-validator.mjs"],"id":"universal-admission-cli","moduleClosure":["scripts/universal-admission-core.mjs","scripts/universal-admission.mjs"],"path":"scripts/universal-admission.mjs","role":"public-intake"},{"frozenVendorImports":["vendor/programmable-applicant-validator/scripts/public-applicant-validator.mjs"],"id":"public-intake-validator","moduleClosure":["review/launch-policy-review-core.mjs","scripts/launch-policy-core.mjs","scripts/launch-policy-handlers.mjs","scripts/verify-open-world-v2-contracts.mjs","scripts/verify-open-world-v2-package.mjs","scripts/verify-open-world-v2-validation-fee.mjs","scripts/verify-open-world-v2-validation-intake.mjs","scripts/verify-open-world-v2-validation-intent.mjs","scripts/verify-public-application-v3-core.mjs","scripts/verify-public-application-v3-generation.mjs","scripts/verify-public-application-v3-shared.mjs","scripts/verify-public-hook-application-core.mjs","scripts/verify-public-hook-application.mjs","scripts/workflow-canary-core.mjs"],"path":"scripts/verify-public-hook-application.mjs","role":"public-intake"},{"frozenVendorImports":["vendor/programmable-applicant-validator/scripts/public-applicant-validator.mjs","vendor/programmable-v4-hook-builder/scripts/github-public-source-lossless-json.mjs","vendor/programmable-v4-hook-builder/scripts/resolve-contract-validation.mjs"],"id":"repository-integrity-gate","moduleClosure":["scripts/applicant-compatibility-core.mjs","scripts/generate-launch-policy-artifacts.mjs","scripts/launch-policy-authority-ownership.mjs","scripts/launch-policy-core.mjs","scripts/launch-policy-handlers.mjs","scripts/registry-core.mjs","scripts/release-version-core.mjs","scripts/verify-repository.mjs"],"path":"scripts/verify-repository.mjs","role":"repository-integrity"},{"frozenVendorImports":["vendor/programmable-applicant-validator/scripts/public-applicant-validator.mjs"],"id":"workflow-canary-validator","moduleClosure":["review/launch-policy-review-core.mjs","scripts/launch-policy-core.mjs","scripts/launch-policy-handlers.mjs","scripts/verify-workflow-canary.mjs","scripts/workflow-canary-core.mjs"],"path":"scripts/verify-workflow-canary.mjs","role":"workflow-canary"}],"fileClasses":{"admission-entrypoint":["review/cli.mjs","review/launch-policy-review-core.mjs","scripts/compile-canary-eligibility.mjs","scripts/compile-launch-entitlement.mjs","scripts/generate-launch-policy-artifacts.mjs","scripts/launch-policy.mjs","scripts/universal-admission.mjs","scripts/verify-public-hook-application.mjs","scripts/verify-repository.mjs","scripts/verify-workflow-canary.mjs"],"authority-ownership-control":["policy/schemas/launch-policy-authority-ownership.v1.schema.json","scripts/launch-policy-authority-ownership.mjs"],"authority-ownership-manifest":["policy/launch-policy-authority-ownership.v1.json"],"canonical-admission-policy":["policy/launch-policy.v1.json"],"current-admission-implementation":["review/open-review-engine.mjs","scripts/applicant-compatibility-core.mjs","scripts/launch-policy-core.mjs","scripts/launch-policy-handlers.mjs","scripts/universal-admission-core.mjs","scripts/verify-open-world-v2-contracts.mjs","scripts/verify-open-world-v2-package.mjs","scripts/verify-open-world-v2-validation-fee.mjs","scripts/verify-open-world-v2-validation-intake.mjs","scripts/verify-open-world-v2-validation-intent.mjs","scripts/verify-public-application-v3-core.mjs","scripts/verify-public-application-v3-generation.mjs","scripts/verify-public-application-v3-shared.mjs","scripts/verify-public-hook-application-core.mjs","scripts/workflow-canary-core.mjs"],"current-admission-support":["scripts/acceptance-entitlement-core.mjs","scripts/canary-eligibility-core.mjs"],"frozen-legacy-compatibility":["docs/builder/intake-status.json","registry/config.json","vendor/receipt.json"],"generated-public-projection":[".github/workflows/verify-hook-builder.yml",".github/workflows/verify-post-merge.yml",".github/workflows/verify.yml",".programmable/active-contract.json",".programmable/applicant-compatibility.v1.json","AGENTS.md","CONTRIBUTING.md","README.md","acceptance/schemas/canary-eligibility-envelope-v1.schema.json","acceptance/schemas/launch-entitlement-envelope-v1.schema.json","acceptance/schemas/protected-acceptance-command-v1.schema.json","acceptance/schemas/protected-canary-eligibility-command-v1.schema.json","canary/schemas/workflow-canary-application-v1.schema.json","canary/schemas/workflow-canary-result-v1.schema.json","docs/ACCEPTANCE_ENTITLEMENT_BRIDGE_V1.md","docs/ARCHITECTURE.md","docs/CANARY_ELIGIBILITY_V1.md","docs/CODE_MATURITY.md","docs/DISCOVERY_CONTRACT.md","docs/LAUNCH_POLICY.md","docs/MIGRATION.md","docs/OPEN_REVIEW_STANDARD.md","docs/REVIEW_LIFECYCLE.md","docs/UNIVERSAL_ADMISSION_V1.md","docs/WORKFLOW_CANARY.md","docs/builder/PUBLIC_GITHUB_PR_BETA.md","intake/schemas/applicant-compatibility-v1.schema.json","intake/schemas/applicant-validator-package-receipt-v1.schema.json","intake/schemas/open-world-submission-v2.schema.json","intake/schemas/public-pr-application-v3.schema.json","intake/schemas/universal-admission-v1.schema.json","policy/schemas/launch-policy-binding.v1.schema.json","policy/schemas/launch-policy.v1.schema.json","review/schemas/launch-policy-review-decision.v1.schema.json","review/schemas/launch-policy-review-input.v1.schema.json","review/schemas/open-review-input.v1.schema.json"],"historical-design-record":[".superpowers/sdd/2026-08-13-central-launch-policy/task-6-report.md","docs/superpowers/plans/2026-08-13-central-launch-policy.md","docs/superpowers/specs/2026-08-13-central-launch-policy-design.md"],"repository-support":[".github/CODEOWNERS",".github/ISSUE_TEMPLATE/config.yml",".github/ISSUE_TEMPLATE/documentation.yml",".github/ISSUE_TEMPLATE/review-or-registry-bug.yml",".github/PULL_REQUEST_TEMPLATE.md",".github/workflows/codeql.yml",".gitignore","CODE_OF_CONDUCT.md","LICENSE","SECURITY.md","SUPPORT.md","assets/repository-cover.jpg","assets/social-preview.jpg","canary-submissions/README.md","docs/releases/v1.5.0.md","docs/releases/v1.6.0.md","docs/releases/v1.6.1.md","docs/releases/v1.6.